{
  "schemaVersion": "voxl.generation-provider-manifest/v1",
  "descriptor": {
    "id": "preview-to-atlas-managed-api",
    "version": "0.2.0",
    "providerId": "openai",
    "modelId": "gpt-image-2",
    "modelVersion": "gpt-image-2-2026-04-21",
    "networkAccess": "required",
    "billingRisk": "possible",
    "supportedOperations": ["create", "revise"]
  },
  "executionClass": "managed-api",
  "computeOwnership": "provider-managed",
  "credentialMode": "external-at-execution",
  "configuration": {
    "id": "preview-to-atlas-api-evaluation-defaults",
    "values": {
      "acceptedOutputMediaTypes": ["image/png"],
      "apiSurface": "image-api",
      "outputQuality": "medium",
      "outputSize": "1024x1024",
      "requestPurpose": "generation-evaluation",
      "snapshot": "gpt-image-2-2026-04-21"
    }
  },
  "configurationSha256": "7678888b6778370c07b662c64b3503fdd8cbff6221bdc4e87783f7493dd8b67f",
  "provenanceDossier": {
    "id": "preview-to-atlas-managed-api-review",
    "path": "preview-to-atlas-managed-api.dossier.v1.json",
    "sha256": "eaa0d48af25a9e8c34812f74a25b587474bb81b12b8f1773b47b34c67618e9f1"
  }
}
